{
  "schema_version":"decision-assurance.dats-case/1.0","id":"DATS-003","title":"Outdated evidence requires review","objective":"Prevent stale information from being treated as current fact.",
  "task":{"kind":"ASSESSMENT","locale":"en","instruction":"Assess the decision input and return the normalized governance result.","input":{"claim":"Supplier certification remains valid.","evidence":[{"id":"E1","verifiable":true,"outdated":true,"supports_claim":true}],"constraints":[],"policies":[],"actors":{"generator":"agent-a","approver":"engine"},"risk":{"high_impact":false,"unresolved_uncertainty":false}}},
  "expected_result":{"gate_decision":"REQUIRES_HUMAN_REVIEW","engine_outcome":"REVIEW","human_review":true,"reason_codes":["EVIDENCE_OUTDATED"],"finding_reason_codes":["EVIDENCE_OUTDATED"],"audit_event_types":["decision.received","evidence.validated","finding.created","governance.decided","review.requested"]},
  "failure_signals":["Outdated evidence produces PASS","No review.requested audit event"],"provenance":{"source_type":"PROJECT_OWNED_SYNTHETIC","baseline":"DATS-v0.1.0","license":"Apache-2.0","contains_sensitive_data":false}
}
