{
  "schema_version":"decision-assurance.dats-case/1.0","id":"DATS-010","title":"High-impact unresolved uncertainty","objective":"Escalate high-impact decisions when material uncertainty remains unresolved.",
  "task":{"kind":"ASSESSMENT","locale":"en","instruction":"Assess the decision input and return the normalized governance result.","input":{"claim":"Automatically reject a high-value insurance claim.","evidence":[{"id":"E1","verifiable":true,"supports_claim":true}],"constraints":[],"policies":[],"actors":{"generator":"agent-a","approver":"engine"},"risk":{"high_impact":true,"unresolved_uncertainty":true}}},
  "expected_result":{"gate_decision":"REQUIRES_HUMAN_REVIEW","engine_outcome":"REVIEW","human_review":true,"reason_codes":["HIGH_IMPACT_UNCERTAINTY"],"finding_reason_codes":["HIGH_IMPACT_UNCERTAINTY"],"audit_event_types":["decision.received","evidence.validated","finding.created","governance.decided","review.requested"]},
  "failure_signals":["High-impact unresolved uncertainty produces PASS","Human escalation is absent"],"provenance":{"source_type":"PROJECT_OWNED_SYNTHETIC","baseline":"DATS-v0.1.0","license":"Apache-2.0","contains_sensitive_data":false}
}
