{
  "schema_version":"decision-assurance.dats-case/1.0","id":"DATS-006","title":"Mandatory evidence is missing","objective":"Ensure mandatory evidence gaps cannot silently pass.",
  "task":{"kind":"ASSESSMENT","locale":"en","instruction":"Assess the decision input and return the normalized governance result.","input":{"claim":"Approve supplier onboarding.","evidence":[{"id":"E1","verifiable":true,"supports_claim":true}],"mandatory_evidence_missing":true,"constraints":[],"policies":[],"actors":{"generator":"agent-a","approver":"engine"},"risk":{"high_impact":false,"unresolved_uncertainty":false}}},
  "expected_result":{"gate_decision":"REQUIRES_HUMAN_REVIEW","engine_outcome":"REVIEW","human_review":true,"reason_codes":["MANDATORY_EVIDENCE_MISSING"],"finding_reason_codes":["MANDATORY_EVIDENCE_MISSING"],"audit_event_types":["decision.received","evidence.validated","finding.created","governance.decided","review.requested"]},
  "failure_signals":["Missing mandatory evidence produces PASS","Review request is absent"],"provenance":{"source_type":"PROJECT_OWNED_SYNTHETIC","baseline":"DATS-v0.1.0","license":"Apache-2.0","contains_sensitive_data":false}
}
