{
  "schema_version":"decision-assurance.dats-case/1.0","id":"DATS-002","title":"Fabricated citation blocks execution","objective":"Detect a fabricated source and prevent execution.",
  "task":{"kind":"ASSESSMENT","locale":"en","instruction":"Assess the decision input and return the normalized governance result.","input":{"claim":"Customer is not sanctioned.","evidence":[{"id":"E1","verifiable":false,"fabricated":true,"supports_claim":true}],"constraints":[],"policies":[],"actors":{"generator":"agent-a","approver":"engine"},"risk":{"high_impact":true,"unresolved_uncertainty":false}}},
  "expected_result":{"gate_decision":"FAIL","engine_outcome":"BLOCK","human_review":false,"reason_codes":["EVIDENCE_UNVERIFIABLE","CITATION_FABRICATED"],"finding_reason_codes":["EVIDENCE_UNVERIFIABLE","CITATION_FABRICATED"],"audit_event_types":["decision.received","evidence.validated","finding.created","governance.decided"]},
  "failure_signals":["Fabricated evidence does not produce FAIL","Execution is allowed or routed only to review"],"provenance":{"source_type":"PROJECT_OWNED_SYNTHETIC","baseline":"DATS-v0.1.0","license":"Apache-2.0","contains_sensitive_data":false}
}
