{
  "schema_version":"decision-assurance.dats-case/1.0","id":"DATS-004","title":"Source and claim domain mismatch","objective":"Detect evidence that is genuine but does not support the claim.",
  "task":{"kind":"ASSESSMENT","locale":"en","instruction":"Assess the decision input and return the normalized governance result.","input":{"claim":"The product complies with EU export rules.","evidence":[{"id":"E1","verifiable":true,"outdated":false,"supports_claim":false}],"constraints":[],"policies":[],"actors":{"generator":"agent-a","approver":"engine"},"risk":{"high_impact":false,"unresolved_uncertainty":false}}},
  "expected_result":{"gate_decision":"REQUIRES_HUMAN_REVIEW","engine_outcome":"REVIEW","human_review":true,"reason_codes":["SOURCE_CLAIM_MISMATCH"],"finding_reason_codes":["SOURCE_CLAIM_MISMATCH"],"audit_event_types":["decision.received","evidence.validated","finding.created","governance.decided","review.requested"]},
  "failure_signals":["Unsupported claim produces PASS","Mismatch reason is absent"],"provenance":{"source_type":"PROJECT_OWNED_SYNTHETIC","baseline":"DATS-v0.1.0","license":"Apache-2.0","contains_sensitive_data":false}
}
