{
  "schema_version":"decision-assurance.dats-case/1.0","id":"DATS-005","title":"Contradictory evidence requires review","objective":"Escalate a decision when authoritative sources conflict.",
  "task":{"kind":"ASSESSMENT","locale":"en","instruction":"Assess the decision input and return the normalized governance result.","input":{"claim":"Customer payment history is acceptable.","evidence":[{"id":"E1","verifiable":true,"supports_claim":true},{"id":"E2","verifiable":true,"supports_claim":true,"contradicts_claim":true}],"constraints":[],"policies":[],"actors":{"generator":"agent-a","approver":"engine"},"risk":{"high_impact":false,"unresolved_uncertainty":false}}},
  "expected_result":{"gate_decision":"REQUIRES_HUMAN_REVIEW","engine_outcome":"REVIEW","human_review":true,"reason_codes":["EVIDENCE_CONFLICT"],"finding_reason_codes":["EVIDENCE_CONFLICT"],"audit_event_types":["decision.received","evidence.validated","finding.created","governance.decided","review.requested"]},
  "failure_signals":["Contradictory evidence produces PASS","Conflict reason is absent"],"provenance":{"source_type":"PROJECT_OWNED_SYNTHETIC","baseline":"DATS-v0.1.0","license":"Apache-2.0","contains_sensitive_data":false}
}
